id,rank,original,original_en,source_quote_en,article_text,similarity,source_url,error
113,1.0,"한국은 폐쇄적인 나라였지만, 이번 협상으로 자국을 개방했다","Korea was a closed country, but this negotiation opened its mark.","For him, negotiating a treaty that “opened” Korea to the US would give him a legacy in some ways comparable to the then-renowned Commodore ...","For him, negotiating a treaty that “opened” Korea to the US would give him a legacy in some ways comparable to the then-renowned Commodore ...",0.7196922302246094,https://www.cambridge.org/core/books/divided-america-divided-korea/trump-administrations-place-in-the-history-of-us-relations-with-the-korean-peninsula/9E00C6FEC67976EFA6B45F82B425EC21,
114,1.0,엄청난 사업이 이뤄질 것,There's a lot of business going on.,"President Donald Trump has imposed steep tariffs on China, while Beijing has retaliated with ...","President Donald Trump has imposed steep tariffs on China, while Beijing has retaliated with ... At an October 2025 meeting in South Korea, Trump and ...",0.23190994560718536,https://www.cfr.org/backgrounder/contentious-us-china-trade-relationship,
115,1.0,"우리는 갑자기 한국에 자동차, 트럭, SUV를 팔 수 있게 됐다","All of a sudden, we could sell cars, trucks and SUVs to Korea.",sport utility vehicles and pickup trucks.,President Trump's 15 percent tariff on cars from Japan has angered U.S. sport utility vehicles and pickup trucks. They are a lot larger ...,0.5420831441879272,https://www.nytimes.com/2025/07/24/business/trump-japan-trade-deal-cars.html,
116,1.0,정말로 한국이 시장을 개방하고 있는 것,It's true that South Korea is opening up the market.,South Korea welcomed U.S.,"South Korea welcomed U.S. President Donald Trump on Wednesday with a replica gold crown and awarded him with the ""Grand Order of Mugunghwa"", ...",0.33083271980285645,https://www.reuters.com/world/asia-pacific/south-korea-award-trump-its-highest-medal-gift-him-golden-crown-2025-10-29/,
117,1.0,대출 같은 게 아닌 선물,It's not a loan. It's a gift.,"""We have a deal,” said Trump after meeting with Xi in South Korea.","Avatar of Hannah Northey. ""We have a deal,” said Trump after meeting with Xi in South Korea.",0.055317774415016174,https://subscriber.politicopro.com/article/eenews/2025/10/30/china-still-holds-all-the-cards-trump-xi-reach-rare-earths-deal-00629788,
118,1.0,그들은 우리가 원하는 무엇에든 투자할 수 있는 6천억 달러를 주기로 했다,They're going to give us 600 billion dollars to invest in whatever we want.,"As part of this agreement, Japan and various Japanese companies have outlined their commitments to pursuing the following investments.","As part of this agreement, Japan and various Japanese companies have outlined their commitments to pursuing the following investments.",0.4178246557712555,https://www.whitehouse.gov/fact-sheets/2025/10/28195/,
119,1.0,투자 약속을 이행하지 않으면 어떻게 하느냐,What do you do if you don't make an investment deal?,"The United States and South Korea still can't agree on a key plank of the tentative trade agreement they inked over the summer, despite U.S.","The United States and South Korea still can't agree on a key plank of the tentative trade agreement they inked over the summer, despite U.S.",0.23668469488620758,https://subscriber.politicopro.com/article/2025/10/no-final-trade-deal-with-south-korea-expected-ahead-of-trumps-visit-00624654,
120,1.0,그렇게 되면 35%의 관세를 물게 될 것,And you're going to have 35% tariff.,"On Thursday evening, 10 July, President Trump threatened to impose a new 35% tariff in imports from Canada.","On Thursday evening, 10 July, President Trump threatened to impose a new 35% tariff in imports from Canada. get in touch with us if you need ...",0.5389977693557739,https://www.woodmac.com/blogs/energy-pulse/big-beautiful-bill-us-energy/,
121,1.0,"초기에는 소폭 관세를 부과하겠지만, 1년에서 최대 1년 반 내에 150%로 올리고, 이후에는 250%까지 인상할 것","In the beginning, you're going to have a small tariff, but you're going to go up 150 percent in a year and a half, and then you're going to go up 250 percent later.",GREENWIRE | President Donald Trump on Friday said he will set a 100 percent tariff on Chinese goods starting on Nov.,"GREENWIRE | President Donald Trump on Friday said he will set a 100 percent tariff on Chinese goods starting on Nov. 1 and will ""impose ...",0.4246079921722412,https://subscriber.politicopro.com/article/eenews/2025/10/10/trump-trade-war-china-ee-00601968,
122,1.0,2년전 타이태닉호 관광 잠수정 참사는 막을 수 있었던 인재,"Two years ago, there was a man in the Titanic who was able to stop the tourist substrate.",I ' d like to take this opportunity to welcome you to beautiful San Diego and the OCEANS.,I ' d like to take this opportunity to welcome you to beautiful San Diego and the OCEANS. ' 1 3 MTS/IEEE San Diego conference.,0.31834396719932556,http://ieeexplore.ieee.org/iel7/6732179/6740936/06741388.pdf,
123,1.0,"운영사, 이상 징후 무시","Operator, ignore unusual signs.",li lia liabuku liae liah liambata liang liangmai liangmei liangshan liaodong liaoning liara liaro lias liau lib liba libaali libamba libanza libbo libbung ...,li lia liabuku liae liah liambata liang liangmai liangmei liangshan liaodong liaoning liara liaro lias liau lib liba libaali libamba libanza libbo libbung ...,0.12477701902389526,https://www.ep.sci.hokudai.ac.jp/~inex/y2015/0501/practical/kadaidata/bin/dic2010,
124,1.0,"오션게이트는 해당 데이터와 관련해 어떠한 사후 조치도 취하지 않았고, 예방 정비를 하지도 않았으며 2023년 타이태닉호 탐사에 나서기까지 잠수정을 적절히 보관하지도 않았다","Oceangate hasn't taken any posthumous action with regard to the data, has not been documented, and has not kept the submarine properly until the mission to the Titanic in 2023.",,,,,
125,1.0,2년간 조사 결과 복수 요인이 참사의 원인이 된 것으로 파악됐다,"For two years, research revealed that the revenge factor was responsible for the tragedy.",NewsGPT.ai - The unhuman truth.,NewsGPT.ai - The unhuman truth. 24/7 AI news from around the world.,0.10478879511356354,https://newsgpt.ai/sitemap/,
126,1.0,5명의 생명을 앗아간 이 해양 사고는 미리 예방할 수 있었다,"This ocean accident, which took five lives, could have been prevented.",Hamas Militants' Attack in Southern Israel May Have Been Planned Over a Year in Advance ...,Hamas Militants' Attack in Southern Israel May Have Been Planned Over a Year in Advance ... Coast Guard Completes Recovery of Debris from ...,0.35476595163345337,https://newsgpt.ai/sitemap/,
127,1.0,기존 규제 틀을 벗어나 새로운 영역을 탐험하려는 운영사들에 더 엄격한 규제가 필요하며 그들에게 명확한 선택지를 제공할 필요가 있다,"They need stricter regulation on the part of the operators, who want to explore new areas outside the existing framework, and they need to provide them with clear choices.",existing exists expanding expatriates expected experienced explanations explored exposed expresses expressions extended extending extends extensively ...,existing exists expanding expatriates expected experienced explanations explored exposed expresses expressions extended extending extends extensively ...,0.30630970001220703,https://www.ep.sci.hokudai.ac.jp/~inex/y2015/0501/practical/kadaidata/bin/dic2010,
128,1.0,트럼프와 통화…대러제재·방위협력 논의,Trump's talking... to the Great Reservoir and Defense Cooperation.,"Artyom Lukin studies the regional economic and military balances from the perspective of North Korea, noting that the “overall military balance on the peninsula ...","Artyom Lukin studies the regional economic and military balances from the perspective of North Korea, noting that the “overall military balance on the peninsula ...",0.35069361329078674,https://www.nbr.org/wp-content/uploads/pdfs/publications/asiapolicy19-3_northkorea_rt_july2024.pdf,
129,1.0,우크라이나와 미국의 입장을 조율하고 현재 상황에 대한 평가를 교환했다,I've adjusted the position of Ukraine and the United States and exchanged assessments of the current situation.,Horizontal Escalation: An Asymmetric Approach to Russian Aggression?,Horizontal Escalation: An Asymmetric Approach to Russian Aggression? Michael Fitzsimmons.,0.4048806428909302,https://www.airuniversity.af.edu/Portals/10/SSQ/documents/Volume-13_Issue-1/SSQSpring2019.pdf,
130,1.0,트럼프 대통령은 키이우 및 다른 지역에 대한 러시아의 공습에 대해 아주 잘 알고 있다,President Trump knows very well about the Russian air raids on Kieu and other areas.,▫ “What Russia Got Wrong: Can Moscow Learn from Its Failures in Ukraine?,▫ “What Russia Got Wrong: Can Moscow Learn from Its Failures in Ukraine? ▫ “Why is Cuba's economic reform progressing so slowly?” Jose Antonio Alonso ...,0.2868538498878479,https://issforum.org/journals/JW-Q2-2023-Combined.pdf,
131,1.0,러시아 경제는 계속 쇠퇴하고 있고 그래서 모스크바는 그런 전망과 트럼프 대통령의 결의에 민감하다. 이것은 많은 걸 바꿀 수 있다,"The Russian economy continues to decline, so Moscow is sensitive to that prospect and President Trump's resolution.",Russia and the West have found themselves enmeshed in an expansive economic war as a result of Russian President Vladimir Putin's decision ...,Russia and the West have found themselves enmeshed in an expansive economic war as a result of Russian President Vladimir Putin's decision ...,0.7026898860931396,https://www.fpri.org/article/2023/12/seoul-searching-lessons-from-south-koreas-experience-with-sanctions-against-russia/,
132,1.0,이미 우크라이나 측이 드론 합의 초안을 준비했고 이를 자세히 논의해 결론 낼 준비가 됐다. 가장 강력한 합의 중 하나가 될 수 있다,"Already, the Ukrainians have set up a drone agreement, and they're ready to resolve it in detail, which can be one of the most powerful agreements.","Nowadays, we have seen many robotic systems leveraging the blockchain technology, especially in industrial and military environments to accommodate certain ...","Nowadays, we have seen many robotic systems leveraging the blockchain technology, especially in industrial and military environments to accommodate certain ...",0.38895535469055176,https://www.gcsp.ch/sites/default/files/2024-12/non-traditional-security-cooperation-between-europe-and-south-korea-during-covid-19-pandemic.pdf,
133,1.0,나토 국가와 협력은 계속될 것,The cooperation with the Nato nation will continue.,"And the United States looks forward to Korea – along with Japan, Australia, New Zealand – continuing to increase cooperation with NATO so that ...","And the United States looks forward to Korea – along with Japan, Australia, New Zealand – continuing to increase cooperation with NATO so that ...",0.6128248572349548,https://2021-2025.state.gov/secretary-antony-j-blinken-and-republic-of-korea-foreign-minister-cho-tae-yul-at-a-press-availability/,
134,1.0,"韓, 대북방어 주도적 역할·국방지출의 롤모델될것",You're going to be the role model for North Korea's top defense role and defense spending.,Yet the same article points out that these South Korean firms have warned that ...,Yet the same article points out that these South Korean firms have warned that ... Korea may have to spend even more on defense going into the ...,0.4689294695854187,https://carnegieendowment.org/research/2024/08/the-future-of-k-power-what-south-korea-must-do-after-peaking?lang=en,
135,1.0,한국은 북한에 맞선 강력한 방어에서 더 주도적 역할을 기꺼이 맡으려는 것과 국방 지출 면에서 계속 롤모델이 된다,South Korea continues to be a role model in terms of being willing to take the lead in a more powerful defense against North Korea and in terms of military spending.,South Korea's economic growth will almost certainly slow over the coming decades—but writing off the country's potential would be a mistake ...,South Korea's economic growth will almost certainly slow over the coming decades—but writing off the country's potential would be a mistake ...,0.5379575490951538,https://carnegieendowment.org/research/2024/08/the-future-of-k-power-what-south-korea-must-do-after-peaking?lang=en,
136,1.0,우리와 한국은 지역 안보 환경에 대응하며 동맹을 현대화할 필요에 있어 긴밀히 연계돼 있다,We and South Korea are in close contact with the need to respond to local security and modernize our allies.,"However, if Trump takes steps that undermine South Korean security interests, including meeting Kim Jong Un without consulting Seoul or calling ...","However, if Trump takes steps that undermine South Korean security interests, including meeting Kim Jong Un without consulting Seoul or calling ...",0.5782098770141602,https://www.brookings.edu/articles/is-south-korea-ready-to-define-its-role-in-a-taiwan-strait-contingency/,
137,1.0,"우리는 공동의 위협을 방어할 준비가 돼 있는, 전략적으로 지속가능한 동맹을 만들기 위해 한국과 계속 긴밀히 협력할 것",We will continue to work closely with Korea to create strategic and sustainable alliances that are ready to defend the common threat.,The NDS further explains how we will collaborate with our NATO Allies and partners to reinforce robust deterrence in the face of Russian.,The NDS further explains how we will collaborate with our NATO Allies and partners to reinforce robust deterrence in the face of Russian.,0.59902024269104,https://media.defense.gov/2022/Oct/27/2003103845/-1/-1/1/2022-NATIONAL-DEFENSE-STRATEGY-NPR-MDR.pdf,
138,1.0,폐쇄된 한국 개방…엄청난 사업,Open Korea... big business.,Trump has already criticized South Korea as a security free rider and suggested he would reduce U.S.,Trump has already criticized South Korea as a security free rider and suggested he would reduce U.S. We are not sure what ...,0.4534493684768677,https://www.wilsoncenter.org/blog-post/talking-north-korea-hollywood,
139,1.0,일본에서 사업했으면 체포됐는데 이제 개방,"If you had a business in Japan, you'd be arrested, but now you're open.",And now Japan has totally ...,You're not allowed to do any business. And now Japan has totally ...,0.8078757524490356,https://www.cnbc.com/2025/08/05/cnbc-transcript-president-of-the-united-states-donald-trump-speaks-with-cnbcs-squawk-box-today-.html,
140,1.0,한국도 그들 국가를 개방했다,Korea opened up their country.,"And, would I rather have North Korea have them with Japan sitting there having them also?","And, would I rather have North Korea have them with Japan sitting there having them also? You may very well be better off if that's the case.",0.46685782074928284,https://www.nytimes.com/2016/03/27/us/politics/donald-trump-transcript.html,
141,1.0,개방만 이뤄진게 아니라 엄청난 사업이될 것이다,"It's not just open up, it's going to be a big business.",PRESIDENT DONALD TRUMP: But they don't go and tell you about it.,PRESIDENT DONALD TRUMP: But they don't go and tell you about it. I think he really wants to do business with the U.S.,0.3564831018447876,https://www.cbsnews.com/news/read-full-transcript-norah-odonnell-60-minutes-interview-with-president-trump/,
142,1.0,"한국은 폐쇄된 국가인데, 갑자기 우리는 자동차와 트럭, SUV를 판매할 수 있게됐다","Korea is a closed country, and suddenly we can sell cars, trucks and SUVs.","when you open up South Korea, it's a closed country.","when you open up South Korea, it's a closed country. And now all of a sudden, we're allowed to sell cars into South Korea and trucks and SUVs.",0.8951165676116943,https://www.cnbc.com/2025/08/05/cnbc-transcript-president-of-the-united-states-donald-trump-speaks-with-cnbcs-squawk-box-today-.html,
143,1.0,"일본에서 사업을 했다면, 그들은 당신을 체포했을 것이다. 어떠 사업도 허용되지 않았다","If you had a business in Japan, they would have arrested you. No business was allowed.",And now Japan has totally ...,You're not allowed to do any business. And now Japan has totally ...,0.8102281093597412,https://www.cnbc.com/2025/08/05/cnbc-transcript-president-of-the-united-states-donald-trump-speaks-with-cnbcs-squawk-box-today-.html,
144,1.0,이제는 일본도 그들 국가를 완전히 개방했다,Now Japan has completely opened up their country.,"We want to do this, because we feel both Japan and the United States have an obligation to promote the prosperity and economic development ...","We want to do this, because we feel both Japan and the United States have an obligation to promote the prosperity and economic development ...",0.5375120639801025,https://www.reaganlibrary.gov/archives/speech/radio-address-nation-free-and-fair-trade-4,
145,1.0,다음 주 반도체 관세 발표…韓 시장 개방 성과,Next week's semi-conductor charter announcement...,"One year ago this week, the United States and the European Union (EU) stood up a joint U.S.-EU Task Force on Energy Security launched by President Biden and ...","One year ago this week, the United States and the European Union (EU) stood up a joint U.S.-EU Task Force on Energy Security launched by President Biden and ...",0.35780078172683716,https://it.usembassy.gov/category/news/,
146,1.0,반도체·칩 미국서 제조 원해,I want to make a semiconductor or chip.,Make America Great Again President Donald Trump will announce a $100 billion investment in the U.S.,Make America Great Again President Donald Trump will announce a $100 billion investment in the U.S. over the next four years by chipmaker ...,0.23651549220085144,https://www.facebook.com/groups/howitsmadechannel/posts/10165506560094466/,
147,1.0,EU 등 대미 투자는 대출 아닌 선물,"American investment, like the EU, is not a loan, it's a gift.","In 2025, President Trump increased tariffs on most imports into the United ...","In 2025, President Trump increased tariffs on most imports into the United ... EU Deal as a ""political agreement"" that ""is not legally binding.",0.3475349545478821,https://www.congress.gov/crs-product/R47679,
148,1.0,폐쇄된 국가를 개방했다,Open the closed country.,The best chance for the peace that President Trump seeks is to keep it simple: a ceasefire in place backed by continued US military and intelligence support ...,The best chance for the peace that President Trump seeks is to keep it simple: a ceasefire in place backed by continued US military and intelligence support ...,0.36299604177474976,https://richardhaass.substack.com/p/tammy-wynettes-choice-march-21-2025,
149,1.0,대출이 아닌 선물,It's not a loan. It's a gift.,policy towards the West Bank?,"And if it's not, what is U.S. policy towards the West Bank? I would say I would need to hear that from President Trump when it comes to – ...",0.1766471117734909,https://www.state.gov/?%3Bp=92333&post_type=state_briefing,
150,1.0,우리는 반도체와 칩에 대해 별도의 범주로 발표할 예정,We're going to make a separate presentation on semiconductors and chips.,that these plants are sprouting up everywhere to make sure that we can make chips here.,that these plants are sprouting up everywhere to make sure that we can make chips here. But what I continue to see is that Trump seems to only care about his ...,0.165926992893219,https://www.congress.gov/event/118th-congress/house-event/LC73048/text,
151,1.0,우리는 그것들을 미국에서 제조하길 원한다,We want to make them in America.,"If you – I would suggest that when it comes to the policy of the United States, that sits with President Donald Trump, and he's just – it's like ...","If you – I would suggest that when it comes to the policy of the United States, that sits with President Donald Trump, and he's just – it's like ...",0.19231753051280975,https://www.state.gov/briefings/department-press-briefing-june-10-2025,
152,1.0,다음 주나 그쯤이 될 것,It'll be next week or so.,"I'll be here for this week, but this is it.","I'll be here for this week, but this is it. Thank you, everyone ...",0.3422633707523346,https://www.state.gov/?%3Bp=92333&post_type=state_briefing,
153,1.0,소액 관세,A small tariff.,"Meanwhile, the tariffs explain relatively small ...","Meanwhile, the tariffs explain relatively small ... • President Trump proclaimed an exemption from tariffs for the United Arab Emirates after an.",0.5388795137405396,https://www.usitc.gov/publications/332/pub5405.pdf,
154,1.0,한국은 자국을 개방했다,South Korea has opened its mark.,as the United States withdrawing its protection of South Korea.,and global attention was focused on ... as the United States withdrawing its protection of South Korea.,0.5573287010192871,https://www.congress.gov/crs-product/R45033,
155,1.0,이는 단순한 개방을 넘어 엄청난 사업이 될 것,It's going to be a big business beyond just opening the door.,It's opening up doors of opportunity that have been closed for years.,It's opening up doors of opportunity that have been closed for years. It's still on going too and is documented by the US Army in May ...,0.41213512420654297,https://news.va.gov/138540/va-secretary-addresses-benefits-rumors-video/,
156,1.0,"한국은 폐쇄된 국가였지만 이제 우리는 갑자기 한국에 자동차, 트럭, 스포츠유틸리티차량을 판매할 수 있게 됐다","Korea was a closed country, but now all of a sudden we can sell cars, trucks, sports utility cars to Korea.",They make less expensive smaller cars that are popular in Canada.,They make less expensive smaller cars that are popular in Canada. Makes sense to buy Mexican.,0.42189350724220276,https://www.facebook.com/mexicanlegacyold/posts/-mexico-rewrites-the-auto-industry-story-for-the-first-time-in-three-decades-can/669972242800643/,
157,1.0,우리는 정말로 한국을 개방하고 있다,We're really opening up Korea.,"Thanks to the historic action across all of government under President Trump, the border is more secure than it ever has been, with illegal ...","Thanks to the historic action across all of government under President Trump, the border is more secure than it ever has been, with illegal ...",0.36507153511047363,https://www.state.gov/briefings/department-press-briefing-june-10-2025,
158,1.0,그건 대출이 아니라 선물,It's not a loan. It's a gift.,policy towards the West Bank?,"And if it's not, what is U.S. policy towards the West Bank? I would say I would need to hear that from President Trump when it comes to – ...",0.1766471117734909,https://www.state.gov/?%3Bp=92333&post_type=state_briefing,
159,1.0,우리는 아무것도 갚을 필요가 없다. 그들은 우리가 원하는 어떤 분야에든 투자할 수 있는 6000억달러를 제공했다,They gave us 600 billion dollars to invest in whatever sector we wanted.,"In dollar terms, U.S production of steel and aluminum was $1.5 billion and $1.3 billion higher each year, respectively, than it would have been.","In dollar terms, U.S production of steel and aluminum was $1.5 billion and $1.3 billion higher each year, respectively, than it would have been.",0.3252949118614197,https://www.usitc.gov/publications/332/pub5405.pdf,
160,1.0,그들은 35%의 관세를 내야 한다,They have to pay 35% of the tariff.,16:07 31 JulyBreaking.,"16:07 31 JulyBreaking. US President Donald Trump has raised Canada's tariff rate from 25% to 35% in a new executive order, the ...",0.4491077661514282,https://www.bbc.com/news/live/cpqvdxzwv22t?page=6,
161,1.0,내가 원하는 어떤 분야에든 6000억달러를 투자할 수 있다는 것이 바로 세부 내용,"I can invest 600 billion dollars in any field that I want, and that's what the details are all about.",President Trump continues to prove that nations across the globe can move beyond longstanding conflicts of the past toward a shared future of ...,President Trump continues to prove that nations across the globe can move beyond longstanding conflicts of the past toward a shared future of ...,0.2307136058807373,https://www.state.gov/?%3Bp=92333&post_type=state_briefing,
162,1.0,케빈 두 명 모두 매우 훌륭하고 다른 이들도 매우 뛰어나다,Both Kevins are very good and the others are very good.,I don't see how holding our fighting men and women to high physical ...,If he says something I listen. I don't see how holding our fighting men and women to high physical ...,0.11385297775268555,https://www.facebook.com/james.stavridis/posts/people-are-asking-me-for-hot-take-on-the-conversations-quantico-with-the-secreta/1322795599246552/,
163,1.0,그가 회담을 요청했고 우리가 협상을 타결한다면 연말 전 만날 가능성이 높다,"If he asks for a conference and we settle the deal, we're more likely to meet before the end of the year.","We know at this point, he said that this is really a feel-out meeting.","We know at this point, he said that this is really a feel-out meeting. He said, “I'm going to meet with President Putin.",0.42297443747520447,https://www.state.gov/?%3Bp=92333&post_type=state_briefing,
