id,rank,original,original_en,source_quote_en,article_text,similarity,source_url,error
62,1.0,"애플, 미국내 140조원 규모 투자 예정…트럼프가 6일 발표","Apple, we're going to invest 140 trillion dollars in scale in the U.S.... six days of Trump's release.",And that is what we have been working for.,"And that is what we have been working for. This past year, we made critical investments to secure America's future.",0.4185851514339447,https://bidenwhitehouse.archives.gov/wp-content/uploads/2023/03/ERP-2023.pdf,
63,1.0,우리는 수조달러 규모의 새 공장들을 미국에 건설하는 약속을 받았다,We've been promised to build a trillion-dollar new factory in the United States.,Our mastery of manufacturing and automation helped the United States establish its industrial and military might.,Our mastery of manufacturing and automation helped the United States establish its industrial and military might. were going to make this billion-dollar ...,0.6258282661437988,https://www.govinfo.gov/content/pkg/CHRG-114shrg24175/html/CHRG-114shrg24175.htm,
64,1.0,여러분들은 오늘 애플로부터 하나를 보게 될 가능성이 크다,You're likely to see one from Apple today.,It's in production at virtually every major AI company.,It's in production at virtually every major AI company. It's taught in classrooms from MIT to rural India.,0.2835272550582886,https://x.com/cinjoncin/with_replies,
65,1.0,트럼프 대통령의 '미국 우선주의' 경제 의제는 미국 일자리를 지원하고 미국 기업을 강화하는 수조 달러의 투자를 확보했다,"President Trump's ""U.S. First priority"" economic agenda has won trillions of dollars in investment to support U.S. jobs and to strengthen U.S. enterprises.",,,,,
66,1.0,"오늘 애플 관련 발표는 미국의 경제 및 국가 안보를 지키기 위해 중요한 부품의 생산을 다시 미국으로 가져오는 데 도움이 될, 우리 제조업의 또 다른 승리",Today's Apple announcement is another triumph of our manufacturing that will help us bring back to the United States the production of important parts to protect America's economic and national security.,REPORT TO CONGRESS of the.,REPORT TO CONGRESS of the. U.S.-CHINA ECONOMIC AND.,0.3359629809856415,https://www.uscc.gov/sites/default/files/2022-11/2022_Annual_Report_to_Congress.pdf,
67,,"한국, 대북 방어·국방 지출 확대 본보기",South Korea and North Korea's Defense and Defense Expenditures Intensive,,,,,The size of tensor a (568) must match the size of tensor b (512) at non-singleton dimension 1
68,1.0,美에 139조 추가 투자,One hundred and thirty-nine extra investments.,"Trump took office, Tim Cook, Apple's chief executive, went to the ...","Trump took office, Tim Cook, Apple's chief executive, went to the ... Apple would invest hundreds of billions of dollars in the United States.",0.27155277132987976,https://www.nytimes.com/2025/04/02/technology/trump-tariffs-apple-iphones.html,
69,1.0,미국의 경제 및 국가 안보를 보호하기 위해 핵심 부품 생산의 리쇼어링을 돕게 될 것,"To protect America's economic and national security, you're going to help reshoir the production of key components.",,,,,
70,1.0,자기야 대피해,"Hey, hey, hey, hey, hey, hey, hey, hey, hey, hey, hey, hey, hey, hey, hey, hey, hey, hey, hey, hey, hey, hey, hey, hey, hey, hey, hey, hey, hey, hey, hey, hey, hey, hey, hey, hey, hey, hey, hey, hey, hey, hey, hey, hey, hey, hey, hey, hey, hey, hey, hey, hey, hey, hey, hey, hey, hey, hey, hey, hey, hey, hey, hey, hey, hey, hey, hey.",criticized criticizer criticizers criticizes criticizing criticizinglies ...,criticized criticizer criticizers criticizes criticizing criticizinglies ... hey heyday heyduck heyerdahl Heynis Heysham heywood Heywood Hezekiah hi ...,0.2612275183200836,https://www.eecis.udel.edu/~lliao/cis320f05/dictionary.txt,
71,1.0,죄송하다. 아내에게 문자를 보내야 했다,I had to text my wife.,"in the region, Jansen took a moment to text his wife.","in the region, Jansen took a moment to text his wife. “I thought I had a nice little moment to do that,” he said.",0.5284312963485718,https://www.postbulletin.com/news/local/kttc-meteorologist-goes-viral-warning-his-family-on-air-during-severe-weather,
72,1.0,방송 중 사적인 행동은 비전문적이다,"In the middle of the broadcast, personal behavior is unprofessional.","KTTC News Chief Meteorologist Nick Jansen was three hours into his reporting on storms walloping the Rochester, Minn., region on July 28, ...","KTTC News Chief Meteorologist Nick Jansen was three hours into his reporting on storms walloping the Rochester, Minn., region on July 28, ...",0.22147448360919952,https://nypost.com/2025/08/06/media/minnesota-kttc-meteorologist-nick-jansen-blasted-for-texting-wife-during-severe-weather-report/,
73,1.0,"나는 내 일과 시청자 여러분의 안전을 매우 중요하게 생각하지만, 동시에 남편이자 아버지이기도 하다","I think my work and the audience are very important to your safety, but at the same time, I'm also a husband and father.",But I'm also a husband and a father.,"""I take my job and your safety very seriously. But I'm also a husband and a father.",0.7412563562393188,https://www.the-independent.com/news/world/americas/minnesota-meteorologist-text-weather-b2803873.html,
74,1.0,폭풍 속에서 아내와 아기의 안전을 확인하기 위해 잠깐 시간을 낸 것,I took a moment to check on the safety of my wife and baby during the storm.,Texting your wife in the middle of a broadcast was my signal to take the storm seriously.,Texting your wife in the middle of a broadcast was my signal to take the storm seriously. I now have a new level of storm seriousness.,0.6382879018783569,https://www.facebook.com/wxjansen/posts/thank-youtruly-thank-you-for-all-the-love-and-support-over-the-past-few-days-i-n/1154175349852507/,
75,1.0,악천후에 아내와 아이가 지하실에 안전하게 있는지 확인하기 위해 잠시 문자를 보낸 것,Sending a text for a moment to make sure that my wife and child are safe in the basement in bad weather.,"“In the middle of severe weather, I decided to take a brief moment to make sure my wife and child were safely in the basement.","“In the middle of severe weather, I decided to take a brief moment to make sure my wife and child were safely in the basement.",0.6268634796142578,https://nypost.com/2025/08/06/media/minnesota-kttc-meteorologist-nick-jansen-blasted-for-texting-wife-during-severe-weather-report/,
76,1.0,모두 삶에서 서로를 조금 더 이해하고 존중하자,Let's all understand and respect each other in life.,"Nick concludes his post with, ""Let's all try to show each other a little more understanding and respect in life."" ADVERTISEMENT ...","Nick concludes his post with, ""Let's all try to show each other a little more understanding and respect in life."" ADVERTISEMENT ...",0.5901248455047607,https://krocnews.com/meteorologist-family-priority/,
77,1.0,전문성과 가족을 향한 책임감을 모두 보여준 사례,An example of professional responsibility and family responsibility.,We spend six months back in Minnesota to see friends and family and enjoy ...,When it was time to choose a college ... We spend six months back in Minnesota to see friends and family and enjoy ...,0.11466358602046967,https://wp.stolaf.edu/reunion/files/2021/04/Class-of-1971-Viking-Update-Draft.pdf,
78,1.0,우리 회사는 닉과 기상팀이 지역 사회를 안전하게 지키기 위해 하는 업무를 매우 자랑스럽게 생각한다,Our company thinks Nick and the weather team are very proud of their work to keep the community safe.,“The KTTC team is proud of Nick and the work he and the First ...,“The KTTC team is proud of Nick and the work he and the First ... work they continue to do to keep our communities safe.,0.7170283794403076,https://www.aol.com/meteorologist-goes-viral-texting-wife-211151416.html,
79,1.0,여기엔 직원의 가족들도 포함된다,This includes members of staff's families.,We spend six months back in Minnesota to see friends and family and ...,"We spend six months back in Minnesota to see friends and family and ... Nancy Baseman and I met as staff members at Camp Vermilion in Cook, MN.",0.2400168627500534,https://wp.stolaf.edu/reunion/files/2021/04/Class-of-1971-Viking-Update-Draft.pdf,
80,1.0,이번에 시청자들은 닉이 좋은 남편이자 아버지로서 잠시 시간을 내어 가족의 안전을 확인한 순간을 생중계로 보셨을 것,"This time, as a good husband and father, the viewers would have seen as a live feed when Nick took a moment to check on the safety of his family.","“In this case, viewers saw that happen live — Nick being a good husband and dad by taking a moment and making sure they were safe.” Jansen said ...","“In this case, viewers saw that happen live — Nick being a good husband and dad by taking a moment and making sure they were safe.” Jansen said ...",0.8467575311660767,https://www.twincities.com/2025/08/07/mn-meteorologist-viral-texting-nick-jansen-kttc/,
81,1.0,우리 팀을 지지해주신 분들께 감사드린다,Thank you for supporting our team.,"my wife and child were safely in the basement,” Jensen responded.","my wife and child were safely in the basement,” Jensen responded. Thank you to all those who support our team during such moments.",0.3747174143791199,https://www.adweek.com/tvspy/viewers-support-minnesota-meteorologist-after-hes-criticized-for-checking-in-with-family-during-storm-coverage/,
82,1.0,"구호품 트럭 전복돼 20명 사망, 이스라엘 점령군 탓","20 dead, Israeli occupations.",Israelis were killed by a stabber driving an aid truck toward Gaza.,Israelis were killed by a stabber driving an aid truck toward Gaza. Three men in their 20s were shot dead overnight near the southern ...,0.5996125936508179,https://www.timesofisrael.com/liveblog-september-18-2025/,
83,1.0,트럭 운전자들은 몇 주째 생필품을 기다려온 굶주린 사람으로 가득 찬 길을 지나야만 한다,Truck drivers have to walk through the streets full of hungry people who've been waiting for their necessities for weeks.,This policy paper examines the policy of food deprivation and starvation that Israel has pursued in the Gaza Strip since 1948 as a pillar of its ...,This policy paper examines the policy of food deprivation and starvation that Israel has pursued in the Gaza Strip since 1948 as a pillar of its ...,0.26387321949005127,https://www.dohainstitute.org/en/Lists/ACRPS-PDFDocumentLibrary/famine-in-genocide-weaponized-starvation-to-entrench-israeli-settler-colonialism-in-gaza-en.pdf,
84,1.0,이스라엘 점령군이 의도적으로 트럭 보안을 강화하지 않는다,Israeli occupations deliberately do not increase truck security.,"54 Notably, between March 2 and May 18, 2025, not a single aid truck entered the Gaza Strip, ...","54 Notably, between March 2 and May 18, 2025, not a single aid truck entered the Gaza Strip, ... Thus, Israel would use ...",0.5008279085159302,https://www.dohainstitute.org/en/Lists/ACRPS-PDFDocumentLibrary/famine-in-genocide-weaponized-starvation-to-entrench-israeli-settler-colonialism-in-gaza-en.pdf,
85,1.0,이는 점령군이 혼란과 기아를 조장한 탓,This is because the occupation forces have encouraged chaos and starvation.,The likelihood of ethnic cleansing in the coastal regions is high.,The likelihood of ethnic cleansing in the coastal regions is high. It will rise even higher should Assad's troops begin to lose.,0.465620219707489,https://joshualandis.com/blog/round-up/,
86,1.0,"어떤 장애물이나 정치적 조건 없이 식량, 의료, 생명 구조 지원이 이뤄지도록 국제사회와 유엔 등 기구가 긴급히 개입해야 한다","The international community and the U.N. and other organizations must be forced to intervene to provide food, health care and lifesaving support without any obstacles or political conditions.",This policy paper examines the policy of food deprivation and starvation that Israel has pursued in the Gaza Strip since 1948 as a pillar of its ...,This policy paper examines the policy of food deprivation and starvation that Israel has pursued in the Gaza Strip since 1948 as a pillar of its ...,0.4275725185871124,https://www.dohainstitute.org/en/Lists/ACRPS-PDFDocumentLibrary/famine-in-genocide-weaponized-starvation-to-entrench-israeli-settler-colonialism-in-gaza-en.pdf,
87,1.0,이스라엘이 강력하게 개입해야 한다,Israel must intervene strongly.,"“A Jordanian who was supposed to drive a humanitarian aid truck to Gaza, murdered two Israelis at the Allenby border crossing,” the ministry ...","“A Jordanian who was supposed to drive a humanitarian aid truck to Gaza, murdered two Israelis at the Allenby border crossing,” the ministry ...",0.49888405203819275,https://www.timesofisrael.com/liveblog-september-18-2025/,
88,1.0,트럭 행렬을 방해하는 자들에게 관용을 베풀어서는 안 될 것,You must not forgive those who interfere with the truck procession.,"Those episodes showed that while domestic political conflicts can never be fully separated from the regional context, a clear gap of percep- tion ...","Those episodes showed that while domestic political conflicts can never be fully separated from the regional context, a clear gap of percep- tion ...",0.22000029683113098,https://library.oapen.org/bitstream/id/ebc8e08c-befc-4616-8fa0-ef335973693a/9780472902965.pdf,
89,1.0,"워싱턴, 통제 불능","Washington, out of control.","WASHINGTON — As new cases of the coronavirus surfaced Tuesday, some Democratic senators questioned the pace and effectiveness of the federal ...","WASHINGTON — As new cases of the coronavirus surfaced Tuesday, some Democratic senators questioned the pace and effectiveness of the federal ...",0.4632118046283722,https://cnsmaryland.org/2020/03/03/as-new-cases-are-reported-senators-question-governments-coronavirus-response/,
90,1.0,워싱턴DC의 범죄는 완전히 통제 불능 상태,"The crime in Washington, D.C. is completely out of control.","totally out of control,” though the city's crime rates have been falling.","totally out of control,” though the city's crime rates have been falling. doesn't get its act together, and quickly, we will have ...",0.626685380935669,https://www.nytimes.com/2025/08/05/us/politics/trump-doge-member-assaulted.html,
91,1.0,"겨우 14, 15, 16세에 불과한 청소년과 갱단원들이 무고한 시민들을 무차별적으로 공격하고, 강도질을 하고, 불구로 만들고, 총격을 가하고 있다. 그들은 잡혀도 곧 풀려날 걸 알고 있다","Only 14, 15, 16-year-olds and gang members are indiscriminately attacking, robbing, maiming, shooting innocent citizens.","in 2012 in which 12 people perished, along with countless others every day, incidents of gun violence.","in 2012 in which 12 people perished, along with countless others every day, incidents of gun violence. At the time of the shooting at Columbine, I was 14 years ...",0.441273957490921,https://congress.gov/116/chrg/CHRG-116hhrg36360/CHRG-116hhrg36360.htm,
92,1.0,워싱턴DC는 모든 미국인을 위해 그리고 세계가 볼 수 있도록 안전하고 깨끗하며 아름다운 도시가 되어야 한다,"Washington, D.C. should be a safe, clean, beautiful city for all Americans and for the world to see.",Government so that they can give services needed by the ...,Government so that they can give services needed by the ... all of those Americans in our districts who seek services from these workers.,0.3456297516822815,https://www.congress.gov/119/crec/2025/02/05/171/24/modified/CREC-2025-02-05-pt1-PgH485-2.htm,
93,1.0,워싱턴DC의 법은 바뀌어야 한다. 미성년자들을 성인으로 기소해 14세부터 오랜 기간 감옥에 가둬야 한다,The Washington D.C. law has to change.,has the exact same law that exists in your state and in every other ...,"has the exact same law that exists in your state and in every other ... ties that do lots of business in Washington, DC, and also have a.",0.5821247696876526,https://docs.house.gov/meetings/GO/GO00/20241120/117737/HMKP-118-GO00-Transcript-20241120.pdf,
94,1.0,워싱턴DC가 신속히 조치를 취하지 않는다면 연방 정부가 통제할 수밖에 없다. 이런 상황이 계속된다면 나는 권한을 행사해 이 도시를 연방 통제 하에 둘 것,"If the Washington DC doesn't act quickly, then the federal government has to control it.",business through a ...,"Right now, if a strategic competitor seizes control of a U.S. business through a ... then the Government has a say in allowing that transaction to happen.",0.5234146118164062,https://www.govinfo.gov/content/pkg/CHRG-115hhrg31419/html/CHRG-115hhrg31419.htm,
95,1.0,우리가 워싱턴DC를 장악해야 한다,We need to take over D.C.,"Frankly, the federal government should take over control and management of Washington, D.C.” ...","Frankly, the federal government should take over control and management of Washington, D.C.” ... We don't want crime in D.C.",0.7240527868270874,https://www.pbs.org/newshour/politics/can-trump-invoke-a-federal-takeover-of-dc-experts-say-its-possible-but-not-simple,
96,1.0,美에 즉각 수정 요구할 것,I'm going to ask you to fix it immediately.,"And if it's a fair deal, I'll reveal it to the ...","And we're going to see what he has in mind. And if it's a fair deal, I'll reveal it to the ...",0.21642351150512695,https://www.state.gov/?%3Bp=92333&post_type=state_briefing,
97,1.0,"애플, 오늘 미국 투자 계획 발표할 수도","Apple, we could announce the U.S. Investment Plan today.","In July 2022, Samsung announced plans to invest about $192 billion in ...","semiconductor market. In July 2022, Samsung announced plans to invest about $192 billion in ...",0.5326261520385742,https://www.congress.gov/crs-product/R47558,
98,1.0,수조 달러 규모의 새로운 공장 건설을 약속한 기업들이 떼 지어 미국으로 몰려들고 있다,The companies that have promised to build a new factory with trillions of dollars are flocking to the United States.,effect that supply chain relationships have on the amount and composition of U.S.,effect that supply chain relationships have on the amount and composition of U.S. When deciding whether to establish or become ...,0.47254693508148193,https://www.congress.gov/crs-product/R46641,
99,1.0,실제로 오늘 애플의 약속을 보게 될 수도 있다,You can actually see Apple's promise today.,Today I was missing 16 out of 22 items.,"Today I was missing 16 out of 22 items. How can you not notice you are only delivering 3 bags when you order a cantaloupe, bananas, apples and a ...",0.24144050478935242,https://www.facebook.com/groups/188772021580506/posts/1972024003255290/,
100,1.0,"韓 시장 개방, 美자동차에 엄청난 사업 기회","Market opening, big business opportunity for cars.",President Donald Trump could soon announce a ...,"President Donald Trump could soon announce a ... And this is very tricky, because they have a huge trade [surplus]” with the United States.",0.3849885165691376,https://subscriber.politicopro.com/article/2025/07/lutnick-says-trade-deal-with-eu-is-on-trumps-desk-00442754,
101,1.0,"관세 15%로 인하한 대가, 갚아야 하는 대출 아닌 선물","15% tax, not a loan to pay, but a gift to pay.","And, if President Trump wants to give away money ...","But, our Brothers in Arms don't deserve this. And, if President Trump wants to give away money ...",0.3093614876270294,https://news.va.gov/138326/va-secretary-doug-collins-veterans-benefits/,
102,1.0,한국도 시장을 개방했는데 단순히 개방한 것뿐만 아니라 이는 엄청난 비즈니스 기회가 될 것,"South Korea opened the market, not just open it, but it's going to be a huge business opportunity.","to open its agricultural and other markets, Lutnick said in an interview on CNBC.","to open its agricultural and other markets, Lutnick said in an interview on CNBC. “The president's got those deals on his desk, and he's ...",0.4377438426017761,https://subscriber.politicopro.com/article/2025/07/lutnick-says-trade-deal-with-eu-is-on-trumps-desk-00442754,
103,1.0,"한국은 과거 폐쇄된 국가였지만, 갑자기 우리가 한국에 자동차, 트럭, SUV를 수출할 수 있게 되었다","Korea was a closed country, but suddenly we were able to export our cars, trucks, and SUVs to Korea.",President Donald Trump's potentially crippling auto tariffs.,President Donald Trump's potentially crippling auto tariffs. “We must fundamentally reimagine our economy.,0.32829636335372925,https://subscriber.politicopro.com/article/2025/03/carney-says-tariffs-force-new-era-for-canada-u-s-ties-00254857,
104,1.0,그것은 우리가 원하는 대로 투자할 수 있는 우리 돈,It's our money to invest in whatever we want.,President Donald Trump holds up the $5 million gold card as he speaks to reporters ...,"President Donald Trump holds up the $5 million gold card as he speaks to reporters ... ""We're really short on money right now in the U.S.",0.30706697702407837,https://www.npr.org/2025/06/02/nx-s1-5413517/trump-gold-card-visa-immigration-border-gold-green-card-migration-wealthy-five-million,
105,1.0,그들은 지금까지 한 번도 하지 않았던 일을 할 것,They'll do things they've never done before.,"There is many things that are moving that should have an impact that President Trump – again, I don't know what his approach will be.","There is many things that are moving that should have an impact that President Trump – again, I don't know what his approach will be.",0.26842033863067627,https://www.state.gov/?%3Bp=92333&post_type=state_briefing,
106,1.0,EU는 우리에게 6500억 달러를 투자할 것인데 6000억 달러라고 치면 이는 대출이 아니다,"The EU is going to invest 65 billion dollars in us, if it's 600 billion dollars, it's not a loan.","Project 2025 is the blueprint for Trump and MAGA Republicans to gut checks and balances so that they can take over the government, ...","Project 2025 is the blueprint for Trump and MAGA Republicans to gut checks and balances so that they can take over the government, ...",0.2290763258934021,https://lofgren.house.gov/sites/evo-subsites/lofgren.house.gov/files/evo-media-document/Stop%20Project%202025%20Task%20Force's%20Project%202025%20Subject-by-Subject%20Breakdown_7.26.2024.docx-compressed.pdf,
107,1.0,3년 후 갚아야 하는 게 아니고 우리가 원하는 어떤 것에 투자할 수 있는 6000억 달러를 줬다,"We don't have to pay them in three years, we give them 600 billion dollars to invest in anything we want.",can use for “anything we want.,"of billions of dollars that the U.S. can use for “anything we want. “That's not a loan that, oh, gee, three years comes up, we have to pay it ...",0.6636658310890198,https://www.factcheck.org/2025/08/trump-on-eu-and-japan-investments-in-the-u-s/,
108,1.0,면서 ,"Oh, my God.",And my second question: President Trump said that we are going to help ...,"And my second question: President Trump said that we are going to help ... Oh my gosh, Nadia is gracing us with her presence.",0.22500622272491455,https://www.state.gov/?%3Bp=92333&post_type=state_briefing,
109,1.0,라고 말했다. 트럼프는 한국이 지난달 30일 미국과 합의한 3500억 달러 대미 투자에도 이같은 주장을 하고 있다.이에 대해 한국은 3500억 달러 중 1500억 달러는 조선산업에 집중된다고 밝힌 바 있다.이날 인터뷰에서 트럼프 대통령은 ,"In an interview on this day, President Trump said that this is the same argument as the $350 billion U.S. investment that South Korea agreed with on the 30th of the month.","for investment, innovation, and advanced manufacturing.","for investment, innovation, and advanced manufacturing. Since day one, President Trump challenged the assumption that American workers and ...",0.5099369883537292,https://www.state.gov/?%3Bp=92333&post_type=state_briefing,
110,1.0,이라고 말했다.또 ,Again.,"The Atlantic writer Anne Applebaum says President Trump's dismantling of the US civil service system, and his attacks on judges and his opponents, are part of ...","The Atlantic writer Anne Applebaum says President Trump's dismantling of the US civil service system, and his attacks on judges and his opponents, are part of ...",0.1964603066444397,https://www.npr.org/2025/02/19/g-s1-49659/journalist-describes-trumps-movements-as-a-regime-change-towards-authoritarianism,
111,1.0,한국 폐쇄 시장 내가 열었다...엄청난 사업 벌어질 것,The Korean Shutdown Mayor I've opened... is going to be a big business.,"Biggest tax cuts in history, all the stuff we did—We had a great presidency.","Biggest tax cuts in history, all the stuff we did—We had a great presidency. TRUMP: If you have a smart President, he can deal with Russia.",0.2508952021598816,https://www.presidency.ucsb.edu/documents/interview-the-joe-rogan-experience,
112,1.0,의약품에 향후 고율 관세 부과...최대 250%,"I'm going to go to the medicine, and I'm going to charge you a higher tax... up to 250%.",Some Americans fear high health insurance premiums if ACA enhanced subsidies expire: 'Very ...,Some Americans fear high health insurance premiums if ACA enhanced subsidies expire: 'Very ... Some Americans said they're worried that if ...,0.39071768522262573,https://www.facebook.com/reprichardneal/posts/just-yesterday-i-heard-from-a-constituent-who-received-a-notice-from-the-masshea/1364955091667593/,
