id,rank,original,original_en,source_quote_en,article_text,similarity,source_url,error
212,1.0,왜냐하면 우리는 그것들을 미국에서 생산하기를 원하기 때문,Because we want to produce them in America.,And we want them to help us with North Korea.,And we want them to help us with North Korea. I want to make the Senate happy because ultimately they're making the judgment.,0.2564980983734131,https://trumpwhitehouse.archives.gov/briefings-statements/remarks-president-trump-united-states-mexico-canada-agreement/,
213,1.0,"처음에는 의약품에 약간의 관세를 부과하지만, 1년이나 최대 1년반 뒤에는 150%로 올리고, 이후에는 250%로 올릴 것","You start with a little tariff on your medicine, but you go up 150 percent in a year and a half, and then you go up 250 percent in a year.","fraught with so many problems over the years, but I thiul.","environment if they are going to maintain their high levels of economic ... fraught with so many problems over the years, but I thiul. ill!~< indica- tive ...",0.17562001943588257,https://www.esd.whs.mil/Portals/54/Documents/FOID/Reading%20Room/Other/15-F-0483_DOC_04_final_DOC_ODNA_Institutional_Economic_and_Organizational_Basis_of_Military_Capability.pdf,
214,1.0,한국은 자기 나라를 개방했는데 그 뿐만 아니라 그건 엄청난 사업이 될 것,"Korea has opened its own country, and it's going to be a big business.",He said the nuclear deal the United States is trying to work with North Korea ...,He said the nuclear deal the United States is trying to work with North Korea ... But they are worried about the future of their children and the future of ...,0.3251233696937561,https://clinton.presidentiallibraries.us/items/show/39413?output=omeka-xml,
215,1.0,"한국은 폐쇄된 국가였는데 이제 갑자기 우리는 한국에 자동차, 트럭, SUV를 팔 수 있게 됐다","Korea was a closed country, and all of a sudden we could sell cars, trucks and SUVs to Korea.","During World War II (1945), a Japanese boy stood in front of a funeral pyre and waited his turn to cremate his little dead brother.","During World War II (1945), a Japanese boy stood in front of a funeral pyre and waited his turn to cremate his little dead brother.",0.252920001745224,https://www.facebook.com/groups/writerrush/posts/3917435535195868/,
216,1.0,우리는 정말로 한국을 개방하고 있다,We're really opening up Korea.,Thanking All Our Marines for their Service and Sacrifices in the Korean War and Many other Wars.These Marines were fighting for Freedom of the ...,Thanking All Our Marines for their Service and Sacrifices in the Korean War and Many other Wars.These Marines were fighting for Freedom of the ...,0.29334336519241333,https://www.facebook.com/susankeewriter/posts/faces-of-couragethis-is-one-of-the-most-striking-pictures-of-the-korean-war-take/1231288405350603/,
217,1.0,정치적 결정,Political Decisions,"its associated cultural and political dynamics (Mitchell,.","its associated cultural and political dynamics (Mitchell,. 2011) to one in tune with natural limits and cycles.",0.4759345054626465,https://etheses.whiterose.ac.uk/id/eprint/33083/1/Kuehne_K_Geography_PhD_2022.pdf,
218,1.0,선거 운동에서 정치적 경쟁자에게 공개적이고 불법적 압력을 가하기 위해 정치적으로 동기 부여된 결정의 예,Here's an example of a decision that was politically motivated to impose public and illegal pressure on political competitors in the campaign.,its campaigning prospects concerning defusing carbon bombs.,its campaigning prospects concerning defusing carbon bombs. In a context of increasing international momentum around supply-side mitigation and the call to.,0.1914377510547638,https://etheses.whiterose.ac.uk/id/eprint/33083/1/Kuehne_K_Geography_PhD_2022.pdf,
219,1.0,폐쇄된 한국 개방...엄청난 사업 될 것,Open the closed Republic of Korea... be a big business.,"WITH CHINA: This week in the Republic of Korea, President Donald J.","WITH CHINA: This week in the Republic of Korea, President Donald J. Open China's market to U.S.",0.6343914866447449,https://www.whitehouse.gov/fact-sheets/2025/11/fact-sheet-president-donald-j-trump-strikes-deal-on-economic-and-trade-relations-with-china/,
220,1.0,한국이 시장을 개방했는데 그건 앞으로 엄청난 사업이 될 것,"South Korea opened the market, and it's going to be a big business.","REBALANCING TRADE WITH CHINA: This week in the Republic of Korea, President Donald J.","REBALANCING TRADE WITH CHINA: This week in the Republic of Korea, President Donald J. Trump reached a trade and economic deal with President ...",0.545762836933136,https://www.whitehouse.gov/fact-sheets/2025/11/fact-sheet-president-donald-j-trump-strikes-deal-on-economic-and-trade-relations-with-china/,
221,1.0,"한국은 폐쇄된 국가였지만 이제 우리는 자동차와 트럭, SUV를 팔 수 있게 됐다","Korea was a closed country, but now we can sell cars, trucks, SUVs.","The East Asia countries produced a combined 16.8% of vehicles sold last year in the U.S., including a record 8.6% from South Korea and 8.2 ...","The East Asia countries produced a combined 16.8% of vehicles sold last year in the U.S., including a record 8.6% from South Korea and 8.2 ...",0.5592787265777588,https://www.cnbc.com/2025/02/13/trump-tariffs-gm-hyundai-south-korean-imports.html,
222,1.0,그렇게 되면 35% 관세를 내야 한다,And then you'll have to pay 35% of the tariff.,US would face a lower tariff rate than Trump threatened in April.,"US would face a lower tariff rate than Trump threatened in April. US, so they do not have to pay the tariffs.",0.5570380687713623,https://www.bbc.com/news/articles/cx23jmvn5yzo,
223,1.0,내가 원하는 아무것에나 6천억 달러를 투자한다는 게 세부 내용,The fact that I'm investing 600 billion dollars in anything I want is the details.,” These commitments deliver on President Trump's initiative to facilitate billions of dollars in investment ...,” These commitments deliver on President Trump's initiative to facilitate billions of dollars in investment ... into the details of what we ...,0.5537850260734558,https://www.state.gov/?%3Bp=92333&post_type=state_briefing,
224,1.0,"의약품 관세, 최고 250%까지 인상할 것","Pharmaceutical tariffs, up to 250%.","one and a half years maximum, it's going to go to 150 percent, and then it is going to go to 250 percent because we want pharmaceuticals made in ...","one and a half years maximum, it's going to go to 150 percent, and then it is going to go to 250 percent because we want pharmaceuticals made in ...",0.6059921383857727,https://www.koreaherald.com/article/10547868,
225,1.0,"처음에는 의약품에 '소액'의 관세를 부과하지만 1년이나 최대 1년 반 뒤에는 150%로 올리고, 이후에는 250%로 올릴 것","We're going to put a small tariff on the drug first, but we're going to raise it to 150 percent in a year and a half, and then we're going to raise it to 250 percent in a year.","tariffs against Canada, which is the U.S.' biggest energy trading partner.","tariffs against Canada, which is the U.S.' biggest energy trading partner. “We're going to put a 25 percent tariff on electricity coming ...",0.48695671558380127,https://subscriber.politicopro.com/article/eenews/2025/03/07/ontario-premier-sticks-to-electricity-tariffs-despite-trump-trade-reversal-ee-00216265,
226,1.0,"한국은 폐쇄된 국가였는데 이제 갑자기 우리는 한국에 자동차, 트럭, SUV를 팔 수 있게 됐다. 우리는 정말로 한국을 개방하고 있다","Korea was a closed country, and all of a sudden we could sell our cars, our trucks, our SUVs to Korea.",Treasury Secretary Scott Bessent on Monday said a trade agreement with South Korea is unlikely to be finalized before President Donald Trump ...,Treasury Secretary Scott Bessent on Monday said a trade agreement with South Korea is unlikely to be finalized before President Donald Trump ...,0.41890937089920044,https://subscriber.politicopro.com/article/2025/10/bessent-says-a-deal-with-south-korea-not-quite-ready-00623600,
227,1.0,그렇게 되면 그들은 35% 관세를 내야 한다,And then they'll have to pay 35% of the tariff.,"US, so they do not have to pay the tariffs.","US, so they do not have to pay the tariffs. Also on Wednesday, Trump said he would impose a 100% tariff on foreign-made semiconductors.",0.5187288522720337,https://www.bbc.com/news/articles/cx23jmvn5yzo,
228,1.0,그건 선물이다. 대출 같은 게 아니다,"It's a gift, not a loan.",that does not need to be repaid.,"that does not need to be repaid. “That's not a loan that, oh, gee, three years comes up, we have to pay it back,” he said.",0.5968375205993652,https://www.factcheck.org/2025/08/trump-on-eu-and-japan-investments-in-the-u-s/,
229,1.0,갚아야 하는 게 아무것도 없다. 그들은 우리가 원하는 아무것에나 투자할 수 있는 6000억 달러를 줬다,They gave us 600 billion dollars to invest in anything we want.,"And I said, ""Well, because they gave me $600 billion."" And that's a ...","And I said, ""Well, because they gave me $600 billion."" And that's a ... They gave us $600 billion that we can invest in anything we want.",0.8365638256072998,https://www.cnbc.com/2025/08/05/cnbc-transcript-president-of-the-united-states-donald-trump-speaks-with-cnbcs-squawk-box-today-.html,
230,1.0,수단 반군에 포위된 도시 수천가구 기아 위험,Thousands of homes surrounded by Sudanese rebels are in danger of starvation.,"Acute food insecurity also persists in Sudan as a result of the ongoing civil war, which has led to mass displacement and severely curtailed ...","Acute food insecurity also persists in Sudan as a result of the ongoing civil war, which has led to mass displacement and severely curtailed ...",0.6872724294662476,https://www.securitycouncilreport.org/atf/cf/%7B65BFCF9B-6D27-4E9C-8CD3-CF6E4FF96FF9%7D/2025_11_forecast.pdf,
231,1.0,기아 대응 메커니즘 고갈…즉각 지원 절실,We're running out of hunger response mechanisms... and we need immediate backup.,We re-run the models with case weights based on a combination of propensity ...,"We re-run the models with case weights based on a combination of propensity ... out that mines have been set up without their permission (WACAM, FoN ...",0.051025401800870895,https://sahelresearch.africa.ufl.edu/wp-content/uploads/sites/170/World-Bank-2022-Climate-Change-and-Conflict-Nexus-in-West-Africa.pdf,
232,1.0,2년 넘는 전쟁으로 도시의 기아 대응 메커니즘이 완전히 고갈됐다,More than two years of war have wiped out urban starvation-resistant mechanisms.,"Acute food insecurity also persists in Sudan as a result of the ongoing civil war, which has led to mass displacement and severely curtailed ...","Acute food insecurity also persists in Sudan as a result of the ongoing civil war, which has led to mass displacement and severely curtailed ...",0.5023373365402222,https://www.securitycouncilreport.org/atf/cf/%7B65BFCF9B-6D27-4E9C-8CD3-CF6E4FF96FF9%7D/2025_11_forecast.pdf,
233,1.0,즉각적이고 지속적인 지원 없이는 많은 생명을 잃을 수 있다,"Without immediate and constant support, we could lose a lot of lives.",been committed in Darfur may be no less serious and heinous than genocide.,been committed in Darfur may be no less serious and heinous than genocide. could lose the support of its largest regional block.,0.42630985379219055,https://www.everycrsreport.com/reports/RL34665.html,
234,1.0,두 케빈 후보 유력,Two Kevin candidates.,two candidates receiving the highest number of votes will be voted ...,"two candidates receiving the highest number of votes will be voted ... Kevin Plachy, Member Benefits CEO Nick Trefry, and Member ...",0.5259519219398499,https://www.wsba.org/docs/default-source/about-wsba/governance/bog-meeting-materials-2021---2022/may-2022/board-of-governors-meeting-materials-may-19-20-2022.pdf,
235,1.0,"나는 스콧을 좋아하지만, 그는 지금 있는 자리에 머물고 싶어 한다","I like Scott, but he wants to stay where he is.","“I love Scott, but he wants to stay where he is,” Trump said.","“I love Scott, but he wants to stay where he is,” Trump said. “He's doing a great job, and he wants to do what he's doing.” Trump did ...",0.7488119602203369,https://subscriber.politicopro.com/article/2025/08/trump-rules-bessent-out-fed-chair-00493583,
236,1.0,두 케빈 모두 훌륭하다,Both Kevins are great.,"Kevin's leadership roles have also included serving on the firm's Compensation Committee, co-leader of the Trade Secrets practice and Chicago office recruiting ...","Kevin's leadership roles have also included serving on the firm's Compensation Committee, co-leader of the Trade Secrets practice and Chicago office recruiting ...",0.37626704573631287,https://www.sheppardmullin.com/kcloutier,
237,1.0,기분 좋은 놀라움,A pleasant surprise.,", he's also the chairman of the.","According to Witness B, when made aware, Representative Meadows seemed “surprised” ... , he's also the chairman of the. , so a little bit of a ...",0.27365124225616455,https://ethics.house.gov/wp-content/uploads/2016/08/OCE-Report-and-Findings_1.pdf,
238,1.0,많은 사람이 '그럴 거면 차기 의장을 그냥 바로 지명하는 게 어떻겠느냐'고 말한다,"A lot of people say, ""Well, why don't you just name your next dress right away?""",,,,,
239,1.0,그것도 가능하다,"That's possible, too.",Unless the employer can demonstrate that no reasonable accommodation was possible ...,Unless the employer can demonstrate that no reasonable accommodation was possible ... Despite John's protestations that he is very happy with his ...,0.11665809899568558,https://www.eeoc.gov/laws/guidance/section-12-religious-discrimination,
240,1.0,이번에는 후회하는 선택을 하고 싶지 않다,I don't want to make regrettable choices this time.,"It is your business, not ...","What should I do as a CEO? It is your business, not ...",0.26638299226760864,https://www.quora.com/I-have-two-employees-that-usually-leave-work-at-6-pm-They-are-good-but-I-don-t-like-that-their-commitment-lasts-for-work-hours-only-What-should-I-do-as-a-CEO,
241,1.0,사람들이 다 훌륭해 보여도 막상 자리에 앉히면 그렇지 않은 경우가 있다,"Sometimes people look great, but when they're just sitting there, they don't.",It could be due to lack ...,"When that can't or won't happen, sometimes it's simply necessary to remove a director. It could be due to lack ...",0.14883235096931458,https://www.501c3.org/kb/adding-and-removing-nonprofit-board-members/,
242,1.0,통화정책은 집단 작업이라는 점이 외부에서 항상 이해되는 것은 아니기 때문에 이런 방식은 위험이 따른다,"Because money policy doesn't always make sense from the outside, it's dangerous.","Conversely, violation of this Code diminishes public confidence in the judiciary and injures our system of government under law.","Conversely, violation of this Code diminishes public confidence in the judiciary and injures our system of government under law. The Canons are rules of reason.",0.2812267243862152,https://www.uscourts.gov/administration-policies/judiciary-policies/ethics-policies/code-conduct-united-states-judges,
243,1.0,"방향을 전환하는 것이 더 어려워질 수 있고, 그 경우 백악관이 실망하면서 그림자 의장이 '의장 지망자'로 전락할 수 있다","The turn could become more difficult, and in that case, the White House would be disappointed, and the shadow chair would be turned into a candidate.","If we do not learn from history, we are unlikely to fully recover from it.","If we do not learn from history, we are unlikely to fully recover from it. Some on Wall Street and in Washington with a stake in the status quo may be ...",0.29558128118515015,https://www.govinfo.gov/content/pkg/GPO-FCIC/pdf/GPO-FCIC.pdf,
244,1.0,세상이 미쳐서,The world is crazy.,But PLEASE do write this book.,"But PLEASE do write this book. It's clear you've got a world built in your mind, and to let it die and turn into regret would be a god damn sin ...",0.18751882016658783,https://www.reddit.com/r/WritingPrompts/comments/3konk3/wp_this_is_the_prologue_or_the_first_chapter_of/,
245,1.0,품질이 좋고 부드럽다,"Good quality, soft.",of photothermal effect of GO.,of photothermal effect of GO. Collagen as the outmost layer supports the soft tissue sealing due to its good biocompatibility and further mineralization.,0.1548278033733368,https://pmc.ncbi.nlm.nih.gov/articles/PMC9071057/,
246,1.0,금연에 큰 도움이 됐다,It's been a big help for you to stop smoking.,Life had displayed before me its glorious indifference.,"Life had displayed before me its glorious indifference. I was not special, I was not going to be much of anything, and then, eventually, I was ...",0.19910675287246704,https://www.reddit.com/r/WritingPrompts/comments/3konk3/wp_this_is_the_prologue_or_the_first_chapter_of/,
247,1.0,직장 스트레스를 받으면 쪽쪽이를 빨며 어린 시절의 안정감을 느낀다,"When you're stressed at work, you suck on the side, and you feel the security of your childhood.","Needless to say, we are stressed because I go back to work in a ...","Needless to say, we are stressed because I go back to work in a ... your opinion in this brand if you have any experience with it?",0.25925105810165405,https://www.rachelobrienibclc.com/blog/bottles-for-breastfed-babies-introducing-a-bottle-part-1/,
248,1.0,세상이 미쳐서 성인들이 쪽쪽이를 찾는다,The world is crazy. Adults look for sides.,How do you deal with mainly the older generation (my parents included ) repeatedly jamming their already used chopsticks in a plate of food ...,How do you deal with mainly the older generation (my parents included ) repeatedly jamming their already used chopsticks in a plate of food ...,0.2513820230960846,https://www.facebook.com/groups/190485286196597/posts/800667201845066/,
249,1.0,하루 3시간 이상 지속적으로 사용할 경우 1년 후 치아 배열이 바뀔 수 있다,"If you continue to use it for more than three hours a day, your tooth configuration can change in a year.",Traumatic dental injuries (TDIs) of teeth occur frequently in children and adolescents.,Traumatic dental injuries (TDIs) of teeth occur frequently in children and adolescents. TDIs that impact the periodontal tissues and ...,0.4104689955711365,https://pmc.ncbi.nlm.nih.gov/articles/PMC11427573/,
250,1.0,입을 벌리는 데 어려움을 겪거나 저작 시 통증을 느낄 수 있다,"You can either have trouble opening your mouth, or you can feel pain in time.",can be a sign of a fungal infection in the mouth.,"can be a sign of a fungal infection in the mouth. In this case, the tongue often feels furry and you might have a strange, bitter taste in your mouth.",0.4140211343765259,https://curaprox.us/blog/post/coated-tongue-symptoms-causes-treatment,
251,1.0,보복 없다,No retaliation.,and China's retaliation.,and China's retaliation. US President Donald Trump makes a trade announcement as US Secretary of Commerce Howard Lutnick ( ...,0.3236020803451538,https://www.aljazeera.com/economy/2025/5/11/us-china-hail-substantial-progress-made-in-tariff-talks-in-geneva,
252,1.0,하와이 갔다 영수증 보고 '깜짝',I went to Hawaii. I saw the receipt.,,,,,
253,1.0,합의 안 지키면 즉각 대응,"If we don't make an agreement, we'll respond immediately.",These politicians will say whatever they need to say to make it seem as if they care.,These politicians will say whatever they need to say to make it seem as if they care. They don't care about me or you.,0.17339962720870972,https://news.va.gov/138326/va-secretary-doug-collins-veterans-benefits/,
254,1.0,오는 7일 자동 발효 예정이던 미국에 대한 관세 대응조치를 6개월간 유예한다,"Six months of delay on customs measures against the United States, which was scheduled for the next seven days of automatic fermentation.",us to get out of the water for a few minutes and then we returned.,us to get out of the water for a few minutes and then we returned. The forecast was saying rain the whole week but its really only a quick ...,0.20031997561454773,https://www.facebook.com/groups/819152661604872/posts/2791330277720424/,
255,1.0,대미 조치를 필요시 언제든 다시 꺼낼 수 있도록 냉동고에 도로 넣어 두는 것,To put them back in the freezer so that we can take them back whenever we need to.,How does that make ...,I hear people put them in the freezer but I've never done that. How does that make ...,0.5018835663795471,https://www.facebook.com/groups/169277108391777/posts/959447509374729/,
256,1.0,의약품 관세 처음엔 낮지만 1년뒤 150%…이후 250%,"Drugs are low at first, but 150% after a year... 250% after that.",,,,,
257,1.0,내주께 품목별 관세 더 발표,"I'm going to give you more items, and I'm going to give you more tickets.",Steel merger brokered by President Trump.,"Speaker, I rise today in strong support of the Nippon Steel and U.S. Steel merger brokered by President Trump.",0.1528465300798416,https://www.congress.gov/119/crec/2025/06/03/171/94/CREC-2025-06-03.pdf,
258,1.0,한국 개방해 엄청난 사업 될 것…EU 대미 투자는 대출 아닌 선물,"The E.U. Investment is a gift, not a loan.","Russia is seeking more Japanese investment in its underdeveloped far east region, while Japan is hoping to resolve a long-running dispute over ...","Russia is seeking more Japanese investment in its underdeveloped far east region, while Japan is hoping to resolve a long-running dispute over ...",0.28103771805763245,https://www.facebook.com/Mofa.Japan.en/posts/pm-takaichi-held-a-telephone-meeting-with-the-honorable-donald-j-trump-president/1322331343260961/,
259,1.0,中과 무역 합의하면 연내 시진핑과 회담…협상타결 근접하고 있다,Trade agreement with V has brought us closer to a deal-symboling and talking-up within the year.,Trump has made no secret of his admiration for the Russian leader ...,Trump has made no secret of his admiration for the Russian leader ... next year's review of the Canada- U.S.-Mexico Agreement on trade.,0.4941994845867157,https://www.facebook.com/Mofa.Japan.en/posts/pm-takaichi-held-a-telephone-meeting-with-the-honorable-donald-j-trump-president/1322331343260961/,
260,1.0,4명의 후보 놓고 고려중,We're considering four candidates.,"In addition to running the company for over three decades, Amway's cofounders, Richard DeVos and Jay Van.","In addition to running the company for over three decades, Amway's cofounders, Richard DeVos and Jay Van. Andel, along with members of their families, have been ...",0.23212337493896484,https://surface.syr.edu/context/etd/article/2091/viewcontent/MONDOM_DAVOR.pdf,
261,1.0,내주 정도,I think it's next week.,House of Representatives passed the.,"Speaker, already this Congress, the. House of Representatives passed the. HALT Fentanyl Act, legislation to crack ...",0.19848889112472534,https://www.congress.gov/119/crec/2025/06/03/171/94/CREC-2025-06-03.pdf,
262,1.0,"처음에는 의약품에 약간의 관세를 부과하지만, 1년이나 최대 1년반 뒤에는 150%로 올리고, 이후에는 250%로 올릴 것","You start with a little tariff on your medicine, but you go up 150 percent in a year and a half, and then you go up 250 percent in a year.","HALT Fentanyl Act, legislation to crack ...","House of Representatives passed the. HALT Fentanyl Act, legislation to crack ...",0.28674837946891785,https://www.congress.gov/119/crec/2025/06/03/171/94/CREC-2025-06-03.pdf,
263,1.0,한국은 자기 나라를 개방했는데 개방했을 뿐만 아니라 그건 엄청난 사업이 될 것,"Korea has opened its own country, but it's not only open it, it's going to be a big business.",President Xi said China has also been promoting #peace talks to resolve various hotspot issues.,President Xi said China has also been promoting #peace talks to resolve various hotspot issues. Noting that the world today is confronted with ...,0.3744290769100189,https://www.facebook.com/frontlinestoriesfromreporters/posts/chinese-president-xijinping-said-that-us-president-donald-trump-is-very-enthusia/1374687397779797/,
264,1.0,"한국은 폐쇄된 국가였는데 이제 갑자기 우리는 한국에 자동차, 트럭, SUV를 팔 수 있게 됐다. 우리는 정말로 한국을 개방하고 있다","Korea was a closed country, and all of a sudden we could sell our cars, our trucks, our SUVs to Korea.",President Trump stepped up to the plate to protect a critical American company.,"President Trump stepped up to the plate to protect a critical American company. Speaker, because of his leadership, the Pennsylvania economy.",0.23511679470539093,https://www.congress.gov/119/crec/2025/06/03/171/94/CREC-2025-06-03.pdf,
265,1.0,그렇게 되면 그들은 35% 관세를 내야 한다,And then they'll have to pay 35% of the tariff.,He described this as a windfall for our region as our economy is knowledge based with intellectual capital as its key driver.,He described this as a windfall for our region as our economy is knowledge based with intellectual capital as its key driver. In six ceremonies ...,0.17314663529396057,https://www.uakron.edu/bot/docs/2017/board%20book%20for%20august%2016%202017%20updated%20aug%2029%202017.pdf,
