id,rank,original,original_en,source_quote_en,article_text,similarity,source_url,error
1,1.0,러 석유 수입 때문,It's because of the oil imports.,"The country is also heavily depen- dent on oil and gas imports, mainly from ...","The country is also heavily depen- dent on oil and gas imports, mainly from ... Under the government of Prime Minister.",0.6688663959503174,https://www.swp-berlin.org/publications/products/comments/2015C14_dge_wgn.pdf,
2,1.0,인도 정부가 현재 러시아산 석유를 직·간접적으로 수입하고 있다고 판단한다,The Indian government is currently importing Russian oil directly or indirectly.,"However, Indian companies significantly increased their volumes of oil imports from Russia.","However, Indian companies significantly increased their volumes of oil imports from Russia. India's total import of Russian oil despite buying additional ...",0.8214298486709595,https://www.gp-mgimo.ru/jour/article/download/28/21,
3,1.0,"이에 따라, 미국 세관 구역으로 수입되는 인도산 제품에 25%의 관세를 추가로 부과한다","As a result, 25 percent more tariffs are added to Indian products imported to the U.S. customs district.",$60 billion to India's ...,with 5 percent average tariffs could add. $60 billion to India's ...,0.6558283567428589,https://jammuuniversity.ac.in/sites/default/files/inline-files/All%20English%20Editorials%2010--8.pdf,
4,1.0,앞으로 24시간 안에 관세를 매우 대폭 인상할 것,"In the next 24 hours, you will raise the tariff to a very large extent.",India and the US have revived talks for a larger ...,India and the US have revived talks for a larger ... And then there are the 25% tariffs on Indian exports to the US as ...,0.44398418068885803,https://jammuuniversity.ac.in/sites/default/files/inline-files/ALL%20ENGLISH%20EDITORIAL%2018.09.2025.pdf,
5,1.0,인도가 러시아산 석유를 사서 '전쟁 기계'에 연료를 공급하고 있다,India is buying Russian oil to fuel the War Machine.,cism of India for its neutral stance on the war.,"cism of India for its neutral stance on the war. Kumar, R., 'India inks deal to ramp up Russian oil imports', The New Indian Express, 30 March 2023 (https ...",0.7366225719451904,https://espas.secure.europarl.europa.eu/orbis/system/files/generated/document/en/EU%20INDIA.pdf,
6,1.0,인도를 특정해 제재하는 것은 부당하고 불합리하다,It's unfair and unreasonable to have India in particular.,India's import of Russian oil.,"25% penalty tariff on Indian goods for. India's import of Russian oil. and “unfair, unjustified and unreasonable”, vowing to protect India's ...",0.47178465127944946,https://jammuuniversity.ac.in/sites/default/files/inline-files/All%20English%20Editorials%2010--8.pdf,
7,1.0,"다른 주요 경제국과 마찬가지로, 인도는 국익과 경제 안보를 지키기 위한 모든 조처를 할 것","Like all major economies, India will do everything to protect national interests and economic security.",security interests in the region because they facilitated economic ...,"Historically, India respected U.S. security interests in the region because they facilitated economic ...",0.6057230234146118,https://link.springer.com/content/pdf/10.1007/s44216-025-00048-6.pdf,
8,1.0,유로존 밖 발주 부진,Adequate discharge outside the eurozone.,Why did euro area monetary policymakers ...,outside the admissible zone. Why did euro area monetary policymakers ...,0.4433690905570984,https://www.ecb.europa.eu/pub/pdf/scpwps/ecb.wp2346~dd78042370.en.pdf,
9,1.0,유로존 외에서 수주 감소가 현저했으며 미국 고관세가 영향을 주었을 가능성이 크다,"In addition to the eurozone, there was a marked drop in the water supply, and there's a strong possibility that the U.S. seniors would have affected it.","European leaders are already acknowledging this, openly discussing the need for greater military and economic independence.","European leaders are already acknowledging this, openly discussing the need for greater military and economic independence. And while Europe has ...",0.27563196420669556,https://www.reddit.com/r/changemyview/comments/1imbzi7/cmv_trump_will_mark_the_beginning_of_the_end_of/,
10,1.0,이는 수주가 회복세로 전환하는 시기가 상당히 늦어질 수 있다는 걸 시사한다,This suggests that the transition to recovery can be very slow.,- A slower and/or ineffective implementation of the National Recovery ...,- A slower and/or ineffective implementation of the National Recovery ... could pave the way for a more resilient and dynamic economic recovery.,0.3587155342102051,https://www.linkedin.com/posts/simona-delle-chiaie-6013ba2_italy-surprises-forecast-activity-7259519300951011328-Sw09,
11,1.0,대미 수출 관세의 영구적인 인상이 예상되면서 산업 부문이 앞으로 외수 부진에 빠질 공산이 농후하다,"With the prospect of a permanent increase in U.S. export tariffs, the industrial sector is going to fall into an out-of-the-out camp.",There's been plenty of news about Germany making it easier for skilled foreign workers to move here and fill the gaps in the labor market.,There's been plenty of news about Germany making it easier for skilled foreign workers to move here and fill the gaps in the labor market.,0.3298225402832031,https://www.reddit.com/r/berlinsocialclub/comments/1gsmyei/what_exactly_is_the_reality_of_germanys_skilled/,
12,1.0,"인도 총리, 트럼프 관세 압박 와중 이달말 7년만에 방중","Prime Minister of India, Trump Customs, is under heavy pressure in the last seven years of the month.","his meeting with Donald Trump in Alaska last month, he had reached ...","his meeting with Donald Trump in Alaska last month, he had reached ... dra Modi's first visit to China after seven years and his.",0.4826344847679138,https://jammuuniversity.ac.in/sites/default/files/inline-files/All%20English%20Editorials%204--9.pdf,
13,1.0,"인도, 러시아 원유 수입","India, Russian oil imports",There has been confusion about the reason outlined—Indian imports of Russian oil ...,There has been confusion about the reason outlined—Indian imports of Russian oil ... President Donald Trump and Ukraine's ...,0.7872073650360107,https://www.brookings.edu/articles/a-challenging-moment-for-the-us-india-relationship/,
14,1.0,절대 먹지 마,Don't eat it.,The next Taiwanese delicacy was a revelation for me when I first encountered it.,The next Taiwanese delicacy was a revelation for me when I first encountered it. I didn't expect to like it—there were clearly intestines in ...,0.3721029460430145,https://thesaltyegg.net/category/travel-tourism/,
15,1.0,최근 폭우로 공원과 도심 곳곳에 버섯이 다량 발생하고 있다,Recent heavy rains have produced large numbers of mushrooms in many parks and urban areas.,Research centers are spearheading the development of the thriving mushroom industry.,"Research centers are spearheading the development of the thriving mushroom industry. The shiitake mushroom, originally grown at high altitudes, was brought to ...",0.5935341715812683,https://www.taiwantoday.tw/Economics/Taiwan-Review/14191/Mushrooming-Innovation,
16,1.0,"독성이 있는 종류가 있을 수 있으므로 절대 임의로 채취하거나 먹지 말고, 발견 시에는 당국에 알려달라","There may be toxic types, so you can never pick them up or eat them at random, and you can tell the authorities when you find them.","It seems that too high levels of various cancer-causing chemicals have been found in Laoganma: Cadmium, mineral oil residues (MOSHs/POSHs) ...","It seems that too high levels of various cancer-causing chemicals have been found in Laoganma: Cadmium, mineral oil residues (MOSHs/POSHs) ...",0.37897706031799316,https://www.facebook.com/groups/2361721520/posts/10156077299276521/,
17,1.0,폐쇄된 한국 개방…다음 주 의약품 관세,Open closed Korean... next week's dispensary.,of words by Trump and the North Korean leader.,of words by Trump and the North Korean leader. General Assembly last month that if the U.S.,0.2844828963279724,https://www.pbs.org/newshour/politics/rex-tillerson-says-continue-diplomacy-north-korea-first-bomb-drops,
18,1.0,"인도 총리, 트럼프 관세 압박 와중 이달말 7년만에 中 방문","Prime Minister Trump, India's Prime Minister, he's been under tariffs for seven years at the end of the month.",President Trump and Indian Prime Minister Narenda Modi fielded questions on Mr.,"President Trump and Indian Prime Minister Narenda Modi fielded questions on Mr. Trump's deportation program, tariffs and the Russia-Ukraine ...",0.5226502418518066,https://www.cbsnews.com/news/trump-india-modi-tariffs-press-conference/,
19,1.0,현재 악화한 지정학적 상황도 논의될 것,We'll discuss the current worsening geopolitical situation.,What did Vladimir Putin and Xi Jinping talk about during their last meeting?,What did Vladimir Putin and Xi Jinping talk about during their last meeting? It turns out that not a single word was said about the wars in ...,0.509474515914917,https://www.facebook.com/ImpactCEE/posts/what-did-vladimir-putin-and-xi-jinping-talk-about-during-their-last-meetingit-tu/1248993437250541/,
20,1.0,러시아의 인도 석유 공급 등 긴급한 문제들도 포함될 예정,"Russia's oil supply, etc., etc., etc., must include urgent problems.","Well, the Russian refiners went in and got into bed with big oil India.","Well, the Russian refiners went in and got into bed with big oil India. Putin gives (Prime Minister Narendra) Modi a discount on the crude.",0.5899156332015991,https://www.facebook.com/thewire.in/posts/white-house-trade-advisor-peter-navarro-has-stirred-a-controversy-as-he-said-tha/809753811722649/,
21,1.0,금요일 밤 노숙자만 노렸다,"On Friday night, only homeless people were out there.","It argues, first, that housing programs in both Chile and Brazil represent a new neoliberal state strategy for managing the urban poor, which I call ...","It argues, first, that housing programs in both Chile and Brazil represent a new neoliberal state strategy for managing the urban poor, which I call ...",0.11413011699914932,https://escholarship.org/uc/item/3k80x5m6,
22,1.0,핵무기 없는 세계,A World Without Nuclear Weapons,a North Korea without nuclear weapons is almost as dangerous to foreigners ...,"a North Korea without nuclear weapons is almost as dangerous to foreigners ... 4 BBC News, “China Overtakes Japan as World's.",0.5403440594673157,https://ndupress.ndu.edu/portals/68/documents/jfq/jfq-64.pdf,
23,1.0,5000명 자르고 AI 직원 1만 개 채용,"I'll cut 5,000 and hire 10,000 AI employees.",,,,,
24,1.0,"AI is Coming for the Consultants. Inside McKinsey, 'This Is Existential'.",AI is Comeing for the Conscientants.,,,,,
25,1.0,AI가 정보를 분석하고 데이터를 수집해 몇 초 만에 매끄러운 파워포인트를 제공할 수 있게 된다면 컨설팅 업계에서 가장 큰 명성을 지닌 맥킨지는 어떻게 될 것인가,"If AI can analyze information and collect data and provide a smooth PowerPoint in a few seconds, what's going to happen to McKinzie, who's the most famous consultant in the consulting industry?",,,,,
26,1.0,"인공지능은 맥킨지 내부 고액 연봉 컨설턴트가 수행하는 기존 업무를 점점 더 빠르게 처리할 수 있게 됐다, 심지어 종종 몇 분 안에 처리를 하기도 한다","AI is able to handle the existing tasks faster and faster, often within a few minutes, done by a high-income consultant inside McKinsey.",,,,,
27,1.0,이러한 현실로 회사는 사업 재편성 필요성이 크게 대두됐다,"In this situation, the company's need for re-integration has become a big deal.",,,,,
28,1.0,"매킨지 이사회 회의 때마다 AI가 화두가 되며, 이는 맥킨지가 고객과 협력하는 방식, 고용 방식 심지어 어떤 프로젝트를 맡는지까지 모두 변화시키고 있다","Every meeting of McKinsey's board has an AI that changes the way McKinzie works with customers, the way she hires, and even what projects she's doing.",,,,,
29,1.0,이미 회사는 해고 및 감원을 통해 2023년 약 4만 5000명이던 직원 수를 4만 명으로 줄였고 이후 약 1만 2000개의 AI 에이전트를 도입했다,"The company has already reduced the number of employees from about 45,000 in 2023 to 40,000 in 2023, followed by about 12,000 AI agents.",,,,,
30,1.0,머지않은 미래에 맥킨지가 고용하는 모든 사람에게 AI 에이언트가 한 명씩 제공될 것,"In the near future, every person that McKinzie hires will have an AI agent.",,,,,
31,1.0,AI가 향후 1~5년 안에 초급 사무직의 절반을 대체할 수 있다,AI can replace half the primary office in the next year or five.,,,,,
32,1.0,이로 인해 실업률이 10~20%까지 오를 수 있다,This can raise unemployment rates from 10 to 20 percent.,,,,,
33,1.0,직업 사다리의 가장 아래 칸이 부서지고 있다,The bottom column on the job ladder is breaking.,,,,,
34,1.0,"법률보조원, 콜센터 상담원 등 사회 진입 직종의 붕괴가 현실화되고 있다","Legal assistants, call center counselors, social-advanced collapses are becoming a reality.",,,,,
35,1.0,"AI가 컨설팅 업계에 '실존적'인 위협이기도 하지만, 우리에게는 실존적인 이익이라고 생각한다","AI is a real threat to the consulting industry, but I think it's a real benefit to us.",,,,,
36,1.0,올림픽에 트랜스젠더 선수? 용납 못 해,A transgender player at the Olympics?,transgender women from participating in women's sports at the Olympics.,"transgender women from participating in women's sports at the Olympics. will host the 2028 Olympic Games in Los Angeles, and Trump's ...",0.7659271955490112,https://www.parkerpoe.com/news/2025/02/president-trumps-executive-order-on-transgender-athletes-poses,
37,1.0,미국은 남성이 여성의 스포츠에 참가해 메달을 빼앗는 것을 용납하지 않을 것,America won't tolerate men taking medals out of women's sports.,With AB Hernandez taking 3 out of 3 medals competing as a biological male ...,With AB Hernandez taking 3 out of 3 medals competing as a biological male ... Female trans athlete participation in sports will take some ...,0.5765246152877808,https://edsource.org/2025/transgender-athlete-wins-shares-state-honors-creating-questions-about-inclusion/733725,
38,1.0,스포츠의 완전성과 공정성을 수호하려는 그의 노력에 감사한다,I thank him for his efforts to protect the integrity and fairness of sports.,Your commitment to ensuring fair competition and protecting the integrity of women's sports is commendable and resonates deeply within the ...,Your commitment to ensuring fair competition and protecting the integrity of women's sports is commendable and resonates deeply within the ...,0.47882160544395447,https://www.iba.sport/news/iba-president-and-ceo-addressed-usa-president-donald-trump-in-an-open-letter,
39,1.0,우리는 매우 강력한 테스트를 시행할 것,We're going to do a very powerful test.,tests had shown they had advantages over other women.,"tests had shown they had advantages over other women. “There will be a very, very strong form of testing,” Trump said Tuesday.",0.39066648483276367,https://www.nytimes.com/athletic/6538232/2025/08/06/president-trump-los-angeles-olympics-transgender-policy-military/,
40,1.0, 부합하지 않으면 경기에 나설 수 없다,"If it doesn't work out, you can't play the game.",United States President Donald Trump has issued an executive order that bans transgender girls and women from participating in women's sports.,United States President Donald Trump has issued an executive order that bans transgender girls and women from participating in women's sports.,0.15013283491134644,https://www.aljazeera.com/news/2025/2/7/whats-behind-trumps-ban-on-transgender-women-in-us-womens-sports,
41,1.0,건설적 대화,Upbuilding Conversations,"Steve Witkoff will hold talks at the Kremlin, after the White ...","Putin and Trump's envoy set for key Ukraine talks in Moscow. Steve Witkoff will hold talks at the Kremlin, after the White ...",0.22018250823020935,https://www.bbc.com/news/world/europe,
42,1.0,상당히 유용하고 건설적인 대화가 이뤄졌다,A very useful and constructive conversation took place.,Had a very good and detailed conversation with my friend President Putin.,Had a very good and detailed conversation with my friend President Putin. I thanked him for sharing the latest developments on Ukraine.,0.463556706905365,https://www.facebook.com/narendramodi/posts/had-a-very-good-and-detailed-conversation-with-my-friend-president-putin-i-thank/1553728572788036/,
43,1.0,"태국, 한국산 유도폭탄으로 훈센 父子 암살 계획","Thailand, South Korea.","Bangkok, Thailand: Deputy Chief of Mission.","Bangkok, Thailand: Deputy Chief of Mission. US Embassy as Regional Center.",0.5255664587020874,"https://adst.org/OH%20TOCs/Huhtala,%20Marie%20Theresa.toc.pdf",
44,1.0,"태국은 훈 센 의장과 훈 마네트의 거주지에 대한 정확한 GPS 좌표 정보를 기다리고 있으며, 기습 암살 공격을 감행할 준비룰 하고 있다","Thailand is waiting for accurate GPS coordinates for Hunsen's suit and his home, and she's preparing for a surprise assassination.",US Embassy as Regional Center.,"Bangkok, Thailand: Deputy Chief of Mission. US Embassy as Regional Center. HIV and Bangkok Protocol.",0.46686577796936035,"https://adst.org/OH%20TOCs/Huhtala,%20Marie%20Theresa.toc.pdf",
45,1.0,"관세, 美경제충격 현재까진 제한적…목표달성은 불확실","The tariffs, the economic shocks, so far, are limited...","For example, the ...","so far on other United States-China trade issues. For example, the ...",0.5273587703704834,https://www.govinfo.gov/content/pkg/CREC-1996-06-27/html/CREC-1996-06-27-pt1-PgH6987.htm,
46,1.0,성장률·물가 영향 있긴 하지만 '대지진' 아닌 '진동' 수준,"The growth rate and water are affected, but it's not a major earthquake, it's a vibration level.","The content of this report represents the contributions of the chapter authors, and does not necessarily represent the opinion of NIST or the Fire.","The content of this report represents the contributions of the chapter authors, and does not necessarily represent the opinion of NIST or the Fire.",0.24217306077480316,https://nvlpubs.nist.gov/nistpubs/specialpublications/nist.sp.1191.pdf,
47,1.0,당초 공약했던 美생산시설 복귀·소득세 대체는 어려울 수도,It may be difficult to replace the re-income or income tax from the earlier low production facilities.,"6.Employment, Supported.","5.Education, Special. 6.Employment, Supported.",0.19427019357681274,https://documents1.worldbank.org/curated/en/665131468331271288/pdf/627830WP0World00PUBLIC00BOX361491B0.pdf,
48,1.0,"관세 실험을 시작한 지 6개월이 지나고 앞으로 며칠 안에 더 많은 관세 발표가 있을 가능성이 있긴 하지만, 경제는 붕괴하지 않았다","Six months after the tariff experiment started, there's probably more tariff announcements in the next few days, but the economy hasn't collapsed.",How high does the trade deficit need to go before we react?,How high does the trade deficit need to go before we react? How many more trade agreements does Communist China have to violate?,0.45652759075164795,https://www.congress.gov/104/crec/1996/06/27/142/97/CREC-1996-06-27-pt1-PgH6987.pdf,
49,1.0,인플레이션이 오르긴 했지만 급등하지는 않았고 슈퍼마켓 선반이 텅 비는 일도 발생하지 않았다,"The inflation went up, but it didn't go up, and the supermarket shelves weren't empty.",Wall Street Journal.,"Wall Street Journal. Expectations for inflation rose sharply, with consumers now seeing prices rising 3.3% on average during the coming year ...",0.46517807245254517,https://www.wsj.com/public/resources/documents/VQViMM7GnfueugoevnTE-WSJNewsPaper-1-25-2025.pdf?gaa_at=eafs&gaa_n=AWEtsqcU_lB26Lc041wEbS5HVMGCTLF6I4MtawqdetuWSbliqOUuj8BJ9Lny&gaa_ts=692feb58&gaa_sig=jfP4W7I0ELSwLtLWcHenLw-jpU_E_SvGiGOjFzCOt1En0FKDQo3A3sdxm5RpG8qiLCVrZYhqtB1rIw_NaQS1Yw%3D%3D,
50,1.0,수입이 감소하는 동시에 수출도 동반 하락할 가능성이 있다,There's also the possibility that the revenues will go down and the exports will go down as well.,The removal of subsidies would also weaken U.S.,"The removal of subsidies would also weaken U.S. cotton exports, to the ...",0.48300477862358093,http://ndl.ethernet.edu.et/bitstream/123456789/3916/1/178%20.%20Pietra_Rivoli.pdf,
51,1.0,혼란스럽고 끊임없이 변화하는 관세 정책이 의사결정을 마비시켰기 때문에 기업들은 광범위하게 리쇼어링을 하지 않고 있다,"The chaos and constant change in customs policies has paralyzed decision-making, so companies are not doing extensive resoling.",U.S.-CHINA ECONOMIC AND SECURITY REVIEW.,RESPONSIBLE STAKEHOLDER? U.S.-CHINA ECONOMIC AND SECURITY REVIEW.,0.162073016166687,https://www.uscc.gov/sites/default/files/transcripts/8.3-4.06HearingTrascript.pdf,
52,1.0,관세가 높기는 하지만 미국에서의 생산을 비싸게 만드는 달러 강세를 상쇄할 만큼 높지는 않다,"The tariff is high, but it's not high enough to compensate for the dollar that makes production expensive in America.",This book aims to introduce the reader to some basic economic prin- ciples and empirical evidence regarding international trade and trade policy so that we can ...,This book aims to introduce the reader to some basic economic prin- ciples and empirical evidence regarding international trade and trade policy so that we can ...,0.42648643255233765,http://ndl.ethernet.edu.et/bitstream/123456789/47784/1/122.pdf,
53,1.0,수입업체들이 부담을 떠안고 있기 때문에 현재까지는 가격 상승폭이 관세에 비해 특별히 크지 않다,"So far, the price rise is not particularly high compared to the tariffs, because the importers are paying for it.","higher than our tariffs on Chinese goods--even without MFN, their tariffs on us would still be higher than ours on them.","higher than our tariffs on Chinese goods--even without MFN, their tariffs on us would still be higher than ours on them. For those with eyes ...",0.5620039701461792,https://www.govinfo.gov/content/pkg/CREC-1996-06-27/html/CREC-1996-06-27-pt1-PgH6987.htm,
54,1.0,"트럼프, 오늘 애플의 1000억 달러 대미 투자 계획 발표","Trump, today we're announcing Apple's $100 billion U.S. investment plan.","Trump (2025-Present)"" 98,""Department of Justice ...","Trump (2025-Present)"" 98,""Department of Justice ... the United States Attorneys"" 22,""ATF Form 4473 - Firearms Transaction Record ...",0.34818607568740845,https://analytics.usa.gov/data/justice/all-pages-realtime.csv,
55,1.0,트럼프 대통령의 '미국 우선' 경제 정책은 미국 일자리를 지원하고 기업을 강화하는 수조 달러의 투자를 이끌어냈다,President Trump's First U.S. Economic Policy led to a trillion-dollar investment to support and strengthen U.S. jobs.,"US-China Tech War: $74 Billion Loss Awaits American Firms As Beijing Opts For Homegrown Software, Chips.","US-China Tech War: $74 Billion Loss Awaits American Firms As Beijing Opts For Homegrown Software, Chips.",0.34432220458984375,https://www.facebook.com/yicaiglobal/posts/intel-has-helped-drive-the-shipment-of-nearly-one-billion-pcs-in-china-since-200/1266077282230269/,
56,1.0,오늘 애플의 발표는 우리 제조업의 또 다른 승리이며 동시에 핵심 부품의 생산으로 미국으로 되돌려 미국의 경제 및 국가 안보를 보호하는 데 도움이 될 것,"Apple's announcement today is another victory for our manufacturing industry, and at the same time the production of key parts will be back to the United States to help protect America's economy and national security.","[JPRT, 112th Congress] [From the U.S.","[JPRT, 112th Congress] [From the U.S. Government Publishing Office] CONGRESSIONAL-EXECUTIVE COMMISSION ON CHINA ANNUAL REPORT 2011 ...",0.31854361295700073,https://www.congress.gov/committee-print/112th-congress/joint-committee-print/68442,
57,1.0,수조 달러 규모의 새로운 공장 건설을 약속한 기업들이 떼 지어 미국으로 몰려들고 있다,The companies that have promised to build a new factory with trillions of dollars are flocking to the United States.,"US-China Tech War: $74 Billion Loss Awaits American Firms As Beijing Opts For Homegrown Software, Chips.","US-China Tech War: $74 Billion Loss Awaits American Firms As Beijing Opts For Homegrown Software, Chips.",0.37812525033950806,https://www.facebook.com/yicaiglobal/posts/intel-has-helped-drive-the-shipment-of-nearly-one-billion-pcs-in-china-since-200/1266077282230269/,
58,1.0,실제로 오늘 애플의 약속을 보게 될 수도 있다,You can actually see Apple's promise today.,Exploitation to China ...,“Apple's iPad City: Subcontracting. Exploitation to China ...,0.39137208461761475,https://www.polyu.edu.hk/apss/people/academic-staff/dr-chan-wai-ling-jenny/-/media/b8e9fe41631e4b838a4a0ef27cc6eb4f.ashx,
59,1.0,우크라서 러 노래를?,It's an ug song?,,,,,
60,1.0,"여러 명이 얽혀 넘어지고, 이들을 밀치며 밀려난 사람들이 주변 사람들까지 넘어뜨리는 혼란스러운 상황이었다","It was a chaotic situation where a lot of people would fall, and people would push them, and people would fall around.",,,,,
61,1.0,오데사는 2022년 전쟁 발발 이후 700차례 이상의 러시아 공습을 겪은 도시,Odesa was a city that had more than 700 attacks on Russia since the war broke out in 2022.,,,,,
